{
  "relevance_to_current_topic": "Highly relevant as a worked example for the repository because it is exactly the kind of paper that benefits from structured extraction: it combines a novel method, explicit equations, pipeline diagrams, benchmark tables, and a mixture of strong and overstated claims.",
  "reusable_ideas": [
    "Use it as an early golden example for method-card extraction because the pipeline is explicit and well modularized.",
    "Use it as a strong claim-evidence example because Table I/II/III support different kinds of claims with different confidence levels.",
    "Use it as a critique example for distinguishing ‘competitive’ from ‘uniformly superior’ empirical framing.",
    "Use it as a reproduction-notes example because the method is detailed enough to analyze but still leaves meaningful practical gaps."
  ],
  "parts_to_ignore": [
    "Do not over-index on the quantum branding alone; much of the reusable reading value here comes from the reasoning-fragment aggregation design.",
    "Do not treat the energy table as a definitive systems benchmark; it is better used as an approximate evidence source for comparative efficiency claims."
  ],
  "what_to_read_next": [
    "Prior work on combinatorial reasoning and QUBO-based reason selection cited as reference [12].",
    "The BF-DCQO and digitized counterdiabatic optimization references [14], [15], [16], [17] for the solver side.",
    "Reasoning aggregation baselines such as self-consistency, Tree-of-Thoughts, and ranked voting cited in references [9], [10], [11]."
  ]
}
