{
  "relevance_to_current_topic": "Highly relevant as the model-adaptation anchor in a multi-paper agent-systems review. It does not study agents directly, but it addresses how the base model layer can be changed efficiently, which matters when agent systems need targeted specialization or low-cost task adaptation.",
  "reusable_ideas": [
    "Use it as the canonical example of parameter-efficient adaptation at the model layer.",
    "Use it as a clean claim-evidence example where method simplicity and practical systems benefits align.",
    "Use it to contrast offline adaptation mechanisms with online interaction-driven agent learning methods."
  ],
  "parts_to_ignore": [
    "Do not treat it as a direct paper about online agent learning or multi-agent coordination.",
    "Do not overextend its conclusions from parameter-efficient adaptation to broader claims about agent performance."
  ],
  "what_to_read_next": [
    "Follow-up parameter-efficient fine-tuning work extending or comparing LoRA variants.",
    "Agent-training papers that study online policy improvement from interaction rather than offline parameter adaptation.",
    "System-scaling papers that study coordination architecture rather than model-update efficiency."
  ]
}
